{
  "schema_version": "1.0",
  "job_id": "test_12min",
  "item_id": "ep1",
  "segments": [
    {
      "start": 1.0,
      "end": 13.68,
      "text": "y a Carlos que venías",
      "language": "es",
      "confidence": 1.0,
      "cluster_id": "SPEAKER_1",
      "speaker_label": "UNKNOWN_2"
    },
    {
      "start": 13.68,
      "end": 14.08,
      "text": "y es verdad",
      "language": "es",
      "confidence": 1.0,
      "cluster_id": "SPEAKER_0",
      "speaker_label": "UNKNOWN_1"
    },
    {
      "start": 14.08,
      "end": 14.76,
      "text": "Alberto Parisi",
      "language": "es",
      "confidence": 1.0,
      "cluster_id": "SPEAKER_0",
      "speaker_label": "UNKNOWN_1"
    },
    {
      "start": 14.76,
      "end": 15.38,
      "text": "buenos días",
      "language": "es",
      "confidence": 1.0,
      "cluster_id": "SPEAKER_0",
      "speaker_label": "UNKNOWN_1"
    },
    {
      "start": 15.38,
      "end": 16.200000000000003,
      "text": "claro que vengo",
      "language": "es",
      "confidence": 1.0,
      "cluster_id": "SPEAKER_1",
      "speaker_label": "UNKNOWN_2"
    },
    {
      "start": 16.200000000000003,
      "end": 17.42,
      "text": "no podía faltar",
      "language": "es",
      "confidence": 1.0,
      "cluster_id": "SPEAKER_1",
      "speaker_label": "UNKNOWN_2"
    },
    {
      "start": 17.42,
      "end": 18.16,
      "text": "oye poca broma",
      "language": "es",
      "confidence": 1.0,
      "cluster_id": "SPEAKER_1",
      "speaker_label": "UNKNOWN_2"
    },
    {
      "start": 18.16,
      "end": 18.48,
      "text": "claro",
      "language": "es",
      "confidence": 1.0,
      "cluster_id": "SPEAKER_1",
      "speaker_label": "UNKNOWN_2"
    },
    {
      "start": 18.48,
      "end": 19.42,
      "text": "buenos días",
      "language": "es",
      "confidence": 1.0,
      "cluster_id": "SPEAKER_1",
      "speaker_label": "UNKNOWN_2"
    },
    {
      "start": 19.42,
      "end": 20.68,
      "text": "yo tampoco podía faltar",
      "language": "es",
      "confidence": 1.0,
      "cluster_id": "SPEAKER_1",
      "speaker_label": "UNKNOWN_2"
    },
    {
      "start": 20.68,
      "end": 21.46,
      "text": "por supuestísimo",
      "language": "es",
      "confidence": 1.0,
      "cluster_id": "SPEAKER_1",
      "speaker_label": "UNKNOWN_2"
    },
    {
      "start": 21.46,
      "end": 22.080000000000002,
      "text": "claro que además",
      "language": "es",
      "confidence": 1.0,
      "cluster_id": "SPEAKER_0",
      "speaker_label": "UNKNOWN_1"
    },
    {
      "start": 22.080000000000002,
      "end": 23.14,
      "text": "los bancos",
      "language": "es",
      "confidence": 1.0,
      "cluster_id": "SPEAKER_0",
      "speaker_label": "UNKNOWN_1"
    },
    {
      "start": 23.14,
      "end": 23.82,
      "text": "tienen mucho que ver",
      "language": "es",
      "confidence": 1.0,
      "cluster_id": "SPEAKER_0",
      "speaker_label": "UNKNOWN_1"
    },
    {
      "start": 23.82,
      "end": 24.5,
      "text": "con los físicos",
      "language": "es",
      "confidence": 1.0,
      "cluster_id": "SPEAKER_0",
      "speaker_label": "UNKNOWN_1"
    },
    {
      "start": 24.5,
      "end": 25.72,
      "text": "que están contratando",
      "language": "es",
      "confidence": 1.0,
      "cluster_id": "SPEAKER_0",
      "speaker_label": "UNKNOWN_1"
    },
    {
      "start": 25.72,
      "end": 26.38,
      "text": "muchos físicos",
      "language": "es",
      "confidence": 1.0,
      "cluster_id": "SPEAKER_0",
      "speaker_label": "UNKNOWN_1"
    },
    {
      "start": 26.38,
      "end": 27.04,
      "text": "y matemáticos",
      "language": "es",
      "confidence": 1.0,
      "cluster_id": "SPEAKER_0",
      "speaker_label": "UNKNOWN_1"
    },
    {
      "start": 27.04,
      "end": 28.34,
      "text": "para hacer análisis de datos",
      "language": "es",
      "confidence": 1.0,
      "cluster_id": "SPEAKER_0",
      "speaker_label": "UNKNOWN_1"
    },
    {
      "start": 28.34,
      "end": 28.92,
      "text": "y todo esto",
      "language": "es",
      "confidence": 1.0,
      "cluster_id": "SPEAKER_1",
      "speaker_label": "UNKNOWN_2"
    },
    {
      "start": 28.92,
      "end": 29.560000000000002,
      "text": "claro el Big Data",
      "language": "es",
      "confidence": 1.0,
      "cluster_id": "SPEAKER_1",
      "speaker_label": "UNKNOWN_2"
    },
    {
      "start": 29.560000000000002,
      "end": 30.44,
      "text": "que nosotros sabemos",
      "language": "es",
      "confidence": 1.0,
      "cluster_id": "SPEAKER_1",
      "speaker_label": "UNKNOWN_2"
    },
    {
      "start": 30.44,
      "end": 31.42,
      "text": "usar las matemáticas",
      "language": "es",
      "confidence": 1.0,
      "cluster_id": "SPEAKER_1",
      "speaker_label": "UNKNOWN_2"
    },
    {
      "start": 31.42,
      "end": 32.160000000000004,
      "text": "sabemos de eso",
      "language": "es",
      "confidence": 1.0,
      "cluster_id": "SPEAKER_1",
      "speaker_label": "UNKNOWN_2"
    },
    {
      "start": 32.160000000000004,
      "end": 33.24,
      "text": "¿los físicos sabéis",
      "language": "es",
      "confidence": 1.0,
      "cluster_id": "SPEAKER_0",
      "speaker_label": "UNKNOWN_1"
    },
    {
      "start": 33.24,
      "end": 34.08,
      "text": "usar las matemáticas?",
      "language": "es",
      "confidence": 1.0,
      "cluster_id": "SPEAKER_0",
      "speaker_label": "UNKNOWN_1"
    },
    {
      "start": 34.260000000000005,
      "end": 35.260000000000005,
      "text": "en general menos",
      "language": "es",
      "confidence": 1.0,
      "cluster_id": "SPEAKER_0",
      "speaker_label": "UNKNOWN_1"
    },
    {
      "start": 35.260000000000005,
      "end": 36.0,
      "text": "que los matemáticos",
      "language": "es",
      "confidence": 1.0,
      "cluster_id": "SPEAKER_0",
      "speaker_label": "UNKNOWN_1"
    },
    {
      "start": 36.0,
      "end": 36.34,
      "text": "pero sí",
      "language": "es",
      "confidence": 1.0,
      "cluster_id": "SPEAKER_0",
      "speaker_label": "UNKNOWN_1"
    },
    {
      "start": 36.34,
      "end": 38.14,
      "text": "lo que pasa",
      "language": "es",
      "confidence": 1.0,
      "cluster_id": "SPEAKER_0",
      "speaker_label": "UNKNOWN_1"
    },
    {
      "start": 38.14,
      "end": 38.620000000000005,
      "text": "es que te has venido",
      "language": "es",
      "confidence": 1.0,
      "cluster_id": "SPEAKER_1",
      "speaker_label": "UNKNOWN_2"
    },
    {
      "start": 38.620000000000005,
      "end": 38.88,
      "text": "Alberto",
      "language": "es",
      "confidence": 1.0,
      "cluster_id": "SPEAKER_1",
      "speaker_label": "UNKNOWN_2"
    },
    {
      "start": 38.88,
      "end": 40.260000000000005,
      "text": "sin tu famosa biblioteca",
      "language": "es",
      "confidence": 1.0,
      "cluster_id": "SPEAKER_1",
      "speaker_label": "UNKNOWN_2"
    },
    {
      "start": 40.260000000000005,
      "end": 41.24,
      "text": "sí es que",
      "language": "es",
      "confidence": 1.0,
      "cluster_id": "SPEAKER_1",
      "speaker_label": "UNKNOWN_2"
    },
    {
      "start": 41.24,
      "end": 42.120000000000005,
      "text": "a ver hemos mirado",
      "language": "es",
      "confidence": 1.0,
      "cluster_id": "SPEAKER_0",
      "speaker_label": "UNKNOWN_1"
    },
    {
      "start": 42.120000000000005,
      "end": 42.86,
      "text": "cómo estaba la sala",
      "language": "es",
      "confidence": 1.0,
      "cluster_id": "SPEAKER_0",
      "speaker_label": "UNKNOWN_1"
    },
    {
      "start": 42.86,
      "end": 43.260000000000005,
      "text": "y hemos dicho",
      "language": "es",
      "confidence": 1.0,
      "cluster_id": "SPEAKER_0",
      "speaker_label": "UNKNOWN_1"
    },
    {
      "start": 43.260000000000005,
      "end": 44.22,
      "text": "habría que echar atrás",
      "language": "es",
      "confidence": 1.0,
      "cluster_id": "SPEAKER_0",
      "speaker_label": "UNKNOWN_1"
    },
    {
      "start": 44.22,
      "end": 45.44,
      "text": "cuatro tabiques",
      "language": "es",
      "confidence": 1.0,
      "cluster_id": "SPEAKER_0",
      "speaker_label": "UNKNOWN_1"
    },
    {
      "start": 45.44,
      "end": 46.7,
      "text": "poner dos puertas nuevas",
      "language": "es",
      "confidence": 1.0,
      "cluster_id": "SPEAKER_0",
      "speaker_label": "UNKNOWN_1"
    },
    {
      "start": 46.7,
      "end": 47.24,
      "text": "y nos han dicho",
      "language": "es",
      "confidence": 1.0,
      "cluster_id": "SPEAKER_1",
      "speaker_label": "UNKNOWN_2"
    },
    {
      "start": 47.24,
      "end": 48.08,
      "text": "mejor no",
      "language": "es",
      "confidence": 1.0,
      "cluster_id": "SPEAKER_0",
      "speaker_label": "UNKNOWN_1"
    },
    {
      "start": 48.08,
      "end": 48.96,
      "text": "pero hubiera quedado chulo",
      "language": "es",
      "confidence": 1.0,
      "cluster_id": "SPEAKER_0",
      "speaker_label": "UNKNOWN_1"
    },
    {
      "start": 48.96,
      "end": 49.84,
      "text": "la biblioteca aquí",
      "language": "es",
      "confidence": 1.0,
      "cluster_id": "SPEAKER_0",
      "speaker_label": "UNKNOWN_1"
    },
    {
      "start": 49.84,
      "end": 51.08,
      "text": "porque el sitio es maravilloso",
      "language": "es",
      "confidence": 1.0,
      "cluster_id": "SPEAKER_0",
      "speaker_label": "UNKNOWN_1"
    },
    {
      "start": 51.08,
      "end": 52.3,
      "text": "está rodeado de madera",
      "language": "es",
      "confidence": 1.0,
      "cluster_id": "SPEAKER_0",
      "speaker_label": "UNKNOWN_1"
    },
    {
      "start": 52.3,
      "end": 53.18000000000001,
      "text": "el sitio está estupendo",
      "language": "es",
      "confidence": 1.0,